{
  "version": "1.0",
  "description": "Golden Set F22 — 50 cas annotés (10 profilage / 8 ESG / 6 carbone / 6 financement / 6 applications / 5 crédit / 4 plan / 5 conversationnels). Réf : specs/032-decision-tree-with-retry-eval/spec.md.",
  "generated_at": "2026-05-07T12:00:00Z",
  "cases": [
    {
      "id": "01-profile-set-sector",
      "category": "profilage",
      "context": {"current_page": "/profile", "active_module": null},
      "user_message": "Mon entreprise est dans l'agriculture biologique au Sénégal",
      "expected": {
        "tool_called": "update_company_profile",
        "payload_contains": {"sector": "agriculture", "country": "Sénégal"}
      },
      "tags": ["mutation", "profile"]
    },
    {
      "id": "02-profile-set-employees",
      "category": "profilage",
      "context": {"current_page": "/profile", "active_module": null},
      "user_message": "Nous sommes 25 employés à Dakar",
      "expected": {
        "tool_called": "update_company_profile",
        "payload_contains": {"employee_count": 25, "city": "Dakar"}
      },
      "tags": ["mutation", "profile"]
    },
    {
      "id": "03-profile-read-current",
      "category": "profilage",
      "context": {"current_page": "/profile", "active_module": null},
      "user_message": "Que sais-tu de mon entreprise ?",
      "expected": {
        "tool_called": ["get_company_profile", "get_company_profile_chat"]
      },
      "tags": ["read", "profile"]
    },
    {
      "id": "04-profile-set-revenue",
      "category": "profilage",
      "context": {"current_page": "/profile", "active_module": "profiling"},
      "user_message": "Notre chiffre d'affaires annuel est de 50 millions FCFA",
      "expected": {
        "tool_called": "update_company_profile",
        "payload_contains": {"annual_revenue_xof": 50000000}
      },
      "tags": ["mutation", "profile"]
    },
    {
      "id": "05-project-list",
      "category": "profilage",
      "context": {"current_page": "/projects", "active_module": null},
      "user_message": "Quels sont mes projets actifs ?",
      "expected": {
        "tool_called": "list_projects"
      },
      "tags": ["read", "project"]
    },
    {
      "id": "06-project-create-solar",
      "category": "profilage",
      "context": {"current_page": "/projects", "active_module": null},
      "user_message": "Je veux ajouter un projet d'installation de panneaux solaires à Bamako",
      "expected": {
        "tool_called": "create_project",
        "payload_contains": {"location_country": "Mali"}
      },
      "tags": ["mutation", "project"]
    },
    {
      "id": "07-project-update-amount",
      "category": "profilage",
      "context": {"current_page": "/projects", "active_module": null},
      "user_message": "Mon projet solaire passe à 80 millions FCFA",
      "expected": {
        "tool_called": "update_project"
      },
      "tags": ["mutation", "project"]
    },
    {
      "id": "08-project-delete-confirm",
      "category": "profilage",
      "context": {"current_page": "/projects", "active_module": null},
      "user_message": "Supprime mon ancien projet brouillon",
      "expected": {
        "tool_called": ["ask_yes_no", "delete_project"]
      },
      "tags": ["destructive", "project"]
    },
    {
      "id": "09-project-detail",
      "category": "profilage",
      "context": {"current_page": "/projects/abc-123", "active_module": null},
      "user_message": "Détails de mon projet d'agroécologie",
      "expected": {
        "tool_called": "get_project"
      },
      "tags": ["read", "project"]
    },
    {
      "id": "10-profile-add-policy",
      "category": "profilage",
      "context": {"current_page": "/profile", "active_module": "profiling"},
      "user_message": "Nous avons une politique de gestion des déchets en place",
      "expected": {
        "tool_called": "update_company_profile",
        "payload_contains": {"has_waste_management": true}
      },
      "tags": ["mutation", "profile", "esg"]
    },
    {
      "id": "11-esg-create",
      "category": "esg",
      "context": {"current_page": "/esg", "active_module": null},
      "user_message": "Je veux démarrer mon évaluation ESG",
      "expected": {
        "tool_called": "create_esg_assessment"
      },
      "tags": ["mutation", "esg"]
    },
    {
      "id": "12-esg-save-criterion",
      "category": "esg",
      "context": {"current_page": "/esg", "active_module": "esg_scoring"},
      "user_message": "Pour le critère E1, je donnerais 8/10",
      "expected": {
        "tool_called": "save_esg_criterion_score",
        "payload_contains": {"criterion_code": "E1", "score": 8}
      },
      "tags": ["mutation", "esg"]
    },
    {
      "id": "13-esg-batch-save",
      "category": "esg",
      "context": {"current_page": "/esg", "active_module": "esg_scoring"},
      "user_message": "Je voudrais évaluer d'un coup E1=8, E2=7, E3=9",
      "expected": {
        "tool_called": "batch_save_esg_criteria"
      },
      "tags": ["mutation", "esg", "batch"]
    },
    {
      "id": "14-esg-finalize",
      "category": "esg",
      "context": {"current_page": "/esg", "active_module": "esg_scoring"},
      "user_message": "J'ai tout évalué, finalise mon évaluation ESG",
      "expected": {
        "tool_called": ["ask_yes_no", "finalize_esg_assessment"]
      },
      "tags": ["mutation", "esg", "destructive_data"]
    },
    {
      "id": "15-esg-read-score",
      "category": "esg",
      "context": {"current_page": "/esg/results", "active_module": null},
      "user_message": "Quel est mon score ESG ?",
      "expected": {
        "tool_called": ["get_esg_assessment", "get_esg_assessment_chat", "show_kpi_card"]
      },
      "tags": ["read", "esg", "kpi"]
    },
    {
      "id": "16-esg-multi-ref",
      "category": "esg",
      "context": {"current_page": "/esg", "active_module": "esg_scoring"},
      "user_message": "Compare mon évaluation Mefali vs IFC vs GRI",
      "expected": {
        "tool_called": ["compare_referentials", "show_comparison_table"]
      },
      "tags": ["read", "esg", "multi_referential"]
    },
    {
      "id": "17-esg-recompute",
      "category": "esg",
      "context": {"current_page": "/esg/results", "active_module": null},
      "user_message": "Recalcule mon score ESG avec le référentiel BOAD",
      "expected": {
        "tool_called": "recompute_score"
      },
      "tags": ["mutation", "esg", "multi_referential"]
    },
    {
      "id": "18-esg-finalize-multi",
      "category": "esg",
      "context": {"current_page": "/esg", "active_module": "esg_scoring"},
      "user_message": "Finalise avec scoring Mefali et GCF en parallèle",
      "expected": {
        "tool_called": "finalize_esg_assessment_multi_ref"
      },
      "tags": ["mutation", "esg", "multi_referential"]
    },
    {
      "id": "19-carbon-create",
      "category": "carbon",
      "context": {"current_page": "/carbon", "active_module": null},
      "user_message": "Je veux faire mon bilan carbone 2026",
      "expected": {
        "tool_called": "create_carbon_assessment",
        "payload_contains": {"year": 2026}
      },
      "tags": ["mutation", "carbon"]
    },
    {
      "id": "20-carbon-save-energy",
      "category": "carbon",
      "context": {"current_page": "/carbon", "active_module": "carbon"},
      "user_message": "Nous consommons 500 kWh d'électricité par mois",
      "expected": {
        "tool_called": "save_emission_entry",
        "payload_contains": {"category": "energy", "quantity": 500, "unit": "kWh"}
      },
      "tags": ["mutation", "carbon"]
    },
    {
      "id": "21-carbon-save-transport",
      "category": "carbon",
      "context": {"current_page": "/carbon", "active_module": "carbon"},
      "user_message": "Notre flotte consomme 200 litres de diesel par semaine",
      "expected": {
        "tool_called": "save_emission_entry",
        "payload_contains": {"category": "transport", "unit": "L"}
      },
      "tags": ["mutation", "carbon"]
    },
    {
      "id": "22-carbon-finalize",
      "category": "carbon",
      "context": {"current_page": "/carbon", "active_module": "carbon"},
      "user_message": "C'est bon, je valide mon bilan carbone",
      "expected": {
        "tool_called": ["ask_yes_no", "finalize_carbon_assessment"]
      },
      "tags": ["mutation", "carbon"]
    },
    {
      "id": "23-carbon-read",
      "category": "carbon",
      "context": {"current_page": "/carbon/results", "active_module": null},
      "user_message": "Donne-moi mon empreinte carbone totale",
      "expected": {
        "tool_called": ["get_carbon_summary", "get_carbon_summary_chat", "show_kpi_card"]
      },
      "tags": ["read", "carbon", "kpi"]
    },
    {
      "id": "24-carbon-cite-source",
      "category": "carbon",
      "context": {"current_page": "/carbon", "active_module": "carbon"},
      "user_message": "Quel est le facteur d'émission du diesel ?",
      "expected": {
        "tool_called": ["search_source", "cite_source"]
      },
      "tags": ["sourcing", "carbon"]
    },
    {
      "id": "25-financing-search",
      "category": "financing",
      "context": {"current_page": "/financing", "active_module": null},
      "user_message": "Quels fonds correspondent à mon profil ?",
      "expected": {
        "tool_called": "search_compatible_funds"
      },
      "tags": ["matching", "financing"]
    },
    {
      "id": "26-financing-fund-detail",
      "category": "financing",
      "context": {"current_page": "/financing", "active_module": null},
      "user_message": "Donne-moi les détails du Green Climate Fund",
      "expected": {
        "tool_called": "get_fund_details"
      },
      "tags": ["read", "financing"]
    },
    {
      "id": "27-financing-save-interest",
      "category": "financing",
      "context": {"current_page": "/financing", "active_module": "financing"},